userName,score,at,content
Rahma Liza,5,6/11/2024 5:56,sangat membantu untuk berpergian kebanyak tempat tidak repot bertanya kesetiap orang cukup dgn google maps hampir semua daerah sudah terjangkau dgn google maps semoga kedepan makin sempurna lagi terimakasih google maps
Adi Darmawan,4,6/11/2024 5:05,sejauh ini membantu banget sih tapi kadang apk nya kadang ngebug pas ngeliat daerah jalan gitu dan tolong ya google pas kita sudah milih rute awal sama rute yang kita tuju sepanjang jalan birunya itu bisa kita klik daerah yang kita ragu yang kita tidak kita ketahui itu aja kurangnya soalnya kalo di lihat dari view jalan ga ngotak jauh banget mana daerahnya cuma beberapa ada jalan yang seperti ada pertigaan perempatan itu di skip jadi saya ga tahu pasti jadinya arah jalannya kemana sekian itu aja
Rendra Abdillah Mukti,1,6/10/2024 20:48,aplikasi jelek masa ganti nama tempat saja gak disetujuin padahal cuma ganti loh dan itu yg namain kan pake akun saya nah terus aku mau ganti nama lagi eh malah ga bisa dasar google maps jelek aplikasi ga jelas minimal perbaiki lah mudahin untuk ganti nama tempat
Praditya Lukmansyah,5,6/10/2024 11:33,terimakasih gmaps berkat fitur street view sama linimasanya aku bisa jadi liat banyak kenangan indah yg mungkin ga bisa terulang lagi kembangin lagi ya banyak fitur bagusnya dan tolong masuk gang yang sedang biar bisa lihat banyak kenangan lagiterimakasih
Llinda Wln,5,6/10/2024 0:06,google maps adalah aplikasi navigasi terbaik yang pernah saya gunakan akurasinya luar biasa dan petunjuk arah yang diberikan sangat jelas dan mudah diikuti fitur penunjuk lalu lintas real time sangat membantu dalam menghindari kemacetan dan informasi mengenai tempat tempat menarik di sekitar sangat berguna antar mukanya juga user friendly dan terus diperbarui dengan fitur fitur baru yang semakin memudahkan pengguna sangat direkomendasikan untuk semua kebutuhan navigasi anda
Gus Indra,4,6/9/2024 23:39,sudah baik namun harus ditingkatkan lagi akurasinya masih kurang masih sering mengarahkan ke jalan yang ditutup portal kalau daerah perumahan dan kadang memilih rute gang buntu padahal tidak ada jalan buat kendaraan
Jodi Jodiya,4,6/9/2024 20:08,saran buat google maps untuk jalan pelosok yang tidak bisa di jangkau mobil untuk tim foto jalan lapangan bisa pakai motor biar maps bisa mencapai pelosok desa
Daniel Pramono,1,6/9/2024 18:36,tambah kacau aja ni maps makin hancur perhitungan jarak dan durasi perjalanannya banyak yg kacau dan gak jelas
Galang Candrawasta,5,6/9/2024 18:11,semakin bagus dan akurat sangat membantu kita dalam berpergian sangat membantu juga dalam melihat maps yang belum pernah di lewati tingkatkan terus googlemaps
Jefry Asmoro Diyatno (emon tuju tiga),1,6/9/2024 16:44,google maps kualitasnya tidak patut dibanggakan terlebih hasil potret dari satelit buram alias kurang jelas dan sangat mengecewakan saya sebagai pengguna kecewa berat dengan google maps sangat miris
Yumna Nuraeni,5,6/9/2024 15:35,aku setiap kemana pun selalu pake gmaps pokoknya aku suka banget ini memudahkan aku untuk terus berjalan menuju tujuanku dengan mudah worth it deh
nicolas s,3,6/9/2024 0:07,saya merasa maps memang sangat membantu dalam perjalanan yang tidak kita ketahui tapi maps memiliki problem yang selalu ada setiap saya ingin pergi dan itu bukan hanya sekali saja tetapi berkali kali mengapa jika kita menjalani rute tersebut selalu saja dibawa kedalam perkampungan atau desa padahal ada jalan raya yang luas dan cepat saya merasa maps hari hari ini selalu error saya selalu dibawa nyasar sampai sampai saya harus nanya ke orang mana jalan yang benar semoga pernyataan ini tersampaikan
ahmad kosasih,2,6/8/2024 23:28,aplikasi minta di update terus mending kalau di update tambah bagus setelah di update malah makin enggak beres contoh history linimasa masa tiap hari history saya ke kota tangerang sama monas terus padahal saya enggak kemana yg lebih parah pernah saya tes jalan yg sudah saya lalui malah di anjurkan ke jalan yg lebih macet sayang aplikasi bawaan hp kalau emang bisa di copot mending gue copot aja masih ada aplikasi waze sistem bobrok
Sae_Zhein _016,1,6/8/2024 23:25,sampai sekarang petunjuk arah suka bikin pusing mau belok ternyata masih jauh giliran terus lewat ehh malah belok yg udah kelewatan jauh ya akhirnya puter balik dong ngasih jalan pintas buat pemotor suruh ngelewatin jalan setapak yg ga bisa di lalui buat motor dan khusus pejalan kaki saja dah gitu titik biru di lokasi maps tidak sesuai lokasi asli
Manaada 1,5,6/8/2024 19:48,navigasi yang akurat navigasi google maps sangat akurat dan andal saya sering menggunakan aplikasi ini untuk bepergian ke tempat tempat baru dan selalu berhasil sampai di tujuan dengan tepat waktu petunjuk arah yang diberikan sangat jelas dan mudah diikuti
Suheriyanto Soleh,4,6/8/2024 7:02,alhamdulillah google maps sangat membantu perjalanan yang cepat dan tanpa kendala namun kadangkala dilewatkan pada jalan terobosan yang sempit sehingga tidak bisa berpapasan dengan mobil lainnya nah akhirnya justru menjadi masalah karena harus mengalah salah satunya
Anton Mulyadi (Anton_Vianny),1,6/7/2024 22:38,walaupun lokasi sudah diberi catatan saat menyimpannya namun sangat sulit untuk mencarinya kembali karena tdk ada fitur pencarian untuk mencari kata kunci pada lokasi yg pernah tersimpan sehingga harus scrolling di list lokasi tersimpan secara manual
abay zen,1,6/7/2024 22:00,aplikasi semakin buruk setelan tema selalu terang tidak fungsi baru pakai  menit tampilan terang tiba berubah menjadi gelap tampilan tidak jelas tampilan malam sangat menggangu perjalanan di siang hari
Abdul Jalal,3,6/7/2024 21:56,bisa dibilang saya tiap hari menggunakan maps dan saya suka namun beberapa hari ini tampilannya kok jd kebalik hp harus ikut diputar supaya sesuai sama tampilan peta parah
novalind johan,3,6/7/2024 8:38,kenapa gmaps saya seringkali signal lost dan seringkali telat membuat saya jadi sering salah jalan di sebabkan maps nya terlambat sudah saya update tapi tetap saja begitu adakah cara supaya gmap menjadi lebih baik
Rhisti Amelia,5,6/7/2024 8:18,aplikasi yang sangat luar biasa bisa membantu saat kita baru pertama kali ke suatu tempat dan juga sudah sesuai titik buat yang kita tuju aplikasi ini sangat bermanfaat sekali untuk saya yang suka traveling intinya mantap deh
Herul Saleh,1,6/6/2024 20:30,saya driver taksi tetapi kenapa ya maps nya sekarang selalu berpindah pindah ga jelas posisi saya di toll tetapi maps di luar toll apalagi sudah masuk komplek perumahan maps muter muter ga jelas membuat saya bingung arah yg tujuan saya padahal sudah saya update maps nya sehingga saya dapat keluhan dari pelanggan kami seolah olah kita sengaja muter muter tolong di perbaiki
Edy Putra,2,6/6/2024 14:48,kenapa linimasi terkadang kilometernya tidak ke simpan padahal sinyal ada histori lokasi aktif minta tolong untuk perbaikan ke depannya
Abia Ayeb,1,6/6/2024 0:27,saya tak suka dg update terbaru ini selesai dengan mode rute sepeda motor dan saat kembali mau menggunakan mode pejalan kaki tidak bisa digunakan ini sangat menyulitkan saya untuk mencapai titik koordinat tujuan sebenarnya dan sangat menyebalkan
MAS bro,1,6/5/2024 23:14,tolong untuk tahun yang lalu jangan di hapus karena itu bisa menjadi kenangan pada sebuah tempat dan mohon agar mem nampilkan ulang di area jalan  karna sudah banyak bangunan yang berubah agar orang tidak salah saat melewati jalan yang sudah beda dari sebelumnya nanti aku penuhin bintangnya
Sigit Andi,2,6/5/2024 19:45,setelah pembaruan kebijakan data linimasa disimpan di perangkat dan dicadangkan ke awan tampilan rute tersimpan jadi kacau balau akses lambat banget
maisab ramadani,1,6/5/2024 18:58,hasil penelusuran dari beberapa lokasi masih yg lama meski sering di update bentuk suatu tempat sekitar satahun sampai  thn yg lalu padahal sdh berubah bentuk bangunan dan nama beberapa bangunan jalan dan lain lain
Firman Febryan,2,6/5/2024 16:39,bug nya kusut perhentian lebih dri  titik tidak bisa klik berikutnya diarahkan ke jalur tercepat walaupun ada lagi yang lebih baik
Harangga Harmawan,5,6/5/2024 10:31,alhamdulillah aplikasi gmaps ini membantu saya dalam mencari lokasi yang sulit ditemukan sehingga mempermudah saya dalam mencari lokasi terimakasih gmaps
Fatimah DuLhamid,5,6/5/2024 8:55,untuk saya google maps ini selalu yg terbaik kemana pun saya pergi melangkah kau hadir untuk selalu jadi teman dan banyak sekali membantu sayaterimakasih google maps
Pengguna Google,3,6/5/2024 8:25,tolong navigasi nya perbaiki lagi setiap deket kenapa hilang saya pusing sebagai ojek kalau main daerah orang sering di tolak tolong perbaiki lagi
hilal budiono,2,6/4/2024 18:32,gila nih google maps lokasi awal dengan lokasi google maps tdk akurat sama sekali lokasi awal di rumah liat google maps malah lokasi berada jauh dari rumah gila emang padahal pengaturan sudah aku izin kan semua seperti lokasi akurat dan lain lain tetap aja lokasinya berbeda jauh
guntoro wp,1,6/4/2024 8:29,keterlaluan kalian sering update bukannya semakin baik malah tambah kacau bagaimana teknisi atau it kalian bekerja pekerjaan saya jadi kacau karena sistem gps pada google map tidak bekerja dengan baik
Andrew rudi,3,6/4/2024 8:28,sayang sekali update terakhir map tidak berfungsi dgn baik saat dipakai menuju ke beberapa tempat sekaligus atau really destination ikon lanjutkan muncul setelah kita sampai di tujuan tp tidak berfungsi saat mau ke tujuan selanjutnya jadi hari mengetik tujuan lagi
Panjul Fajar,2,6/4/2024 5:12,maps nya kurang bagus lambat ketika dalam perjalanan sering putus ketika berhenti lampu merah berhenti sejenak maps tidak berfungsi seperti tidak ada jaringan disuruh manual lagi
ê¹€ìˆ˜ë¹ˆ,1,6/3/2024 8:42,masa di suruh keluar tol terus masuk tol lagi tolong diperbaiki lagi sistemnya udah  minggu begini melulu aku instal ulang malah sama aja malah masuk ke jalan jauh lebih macet
Jakarta Bogor,5,6/2/2024 19:46,saya menambahkan jalan di google maps tetapi masih ditinjau terus tolong min di buatkan secepatnya untuk mempermudah orang yang membutuhkan jalan yang saya tambahkan terimakasih
intan kusumawardhani,4,6/1/2024 21:51,kadang keliru ada jalan lebih enak lebih luas lebih deket malah diputerin ga jelas pernah mau ke suatu cafe di trawas pasang maps lah kok dituntun muterin gunung jalanan naik turun sepi lewat suatu desa yg jalannya sempit keluar desa ketemu jalan besar yg lebih simpel rutenya yg biasa kita lewati walahhabis bensin
Ricofriandes Rico,4,6/1/2024 21:13,sering kali setiap digunakan maps nya berputar putar jadi banyak salah arah jalur dijalan jadinya ke tujuan yg dituju
Deja Vu,1,6/1/2024 18:00,aplikasi yg bikin frustasi walau cukup manfaat sampai ada aplikasi sejenis yg lebih baik tidak menghargai sama sekali para kontributor local guidenya update sesuai kondisi riil pada ditolak terlalu mengandalkan ai yg terbukti tolol di jaman semakin pintar anda sendirian yang semakin bodoh
Partogi Ritonga,3,6/1/2024 17:00,halo maps kalau bisa di perbaiki lagi mapsnya soalnya saya jalan masih jauh kok di suruh belok tolong di perbaiki secara efisien dan efektif agar pengguna maps ga jadi nyasar dan bingung tolong kerjasama nya
chairulanwar arul,5,6/1/2024 15:13,di update kok bukannya makin bagus malah parah kenapa maps nya enggak bisa jalan jadi kacau tolong diperbaiki kalau sudah di update masih blm bisa lagi panah maps nya saya enggak mau update lagi
diiajeng kusuma,4,6/1/2024 13:35,saya berbagi lokasi di google maps dgn suami via email tetapi kenapa kadang real time lokasi tidak bergerak baterai juga tetap dan tertulis  jam yang lalu artinya apa ya dan sy tidak bs melihat posisi suami sy sekarang dimana
Sewa Bean Bag Bali,5,6/1/2024 7:55,saya sangat terbantu dengan fitur jelajah di google maps fitur ini memudahkan saya menemukan tempat tempat baru dan menarik saya senang memberikan ulasan kepada orang orang atau tempat yang saya rekomendasikan dan google maps membuatnya sangat mudah dan menyenangkan selain itu bisnis saya juga mengalami pertumbuhan yang signifikan berkat integrasi dengan google bisnis mengelola profil bisnis langsung di google maps telah memperlancar operasional kami dan meningkatkan visibilitas bisnis
Emanuel Depthios,4,6/1/2024 7:43,koordinatnya tidak bisa disalin setelah update dan setelah klik koordinatnya maka diganti dengan nama jalan ini sangat merepotkan yang ingin menggunakan koordinat
Erica Aprilia,2,6/1/2024 2:54,dulu lancar untuk lihat hasil cek history linimasa akun orang lain di beda perangkat namun sekarang entah eror atau gimana sekarang sdh tidak bisa liat history nya apalagi sekarang di linimasa maps ada tulisan perangkat di akun ini tidak bisa di ceklis untuk salah satu perangkat saja agar riwayatnya tidak double padahal kita ada riwayat berjalan namun tidak tercatat di linimasa
067_Diana Leko,5,5/31/2024 16:37,petunjuk arah jelas dan tidak membingukan alamat yang tersedia lengkap dan titik alamat sesuai ditambah fitur suara yang tersedia sangat membantu
Yuda Duran,5,5/31/2024 11:05,google maps adalah sebuah aplikasi yang sangat bermanfaat dan inovatif dalam membantu pengguna untuk menavigasi secara efisien di berbagai lokasi di seluruh dunia aplikasi ini menawarkan fitur fitur canggih seperti arah navigasi yang akurat informasi lalu lintas real time peta satelit yang jelas serta estimasi waktu tempuh yang akurat selain itu google maps juga memungkinkan pengguna untuk menemukan tempat tempat menarik restoran toko dan layanan lainnya di sekitar mereka dengan antar
M.Bayu Agung,3,5/31/2024 11:02,saya sebagai driver gojek online sangat membutuhkan petunjuk arah tetapi sekarang kurang akurat saya selalu di beri jalan kecil yg tidak bisa di lalu kendaran bermotor terlalu memaksakan dan perlu di ralat kaji ulang lagi jalan jalan yg tidak bisa di lalui kendarana atau jalan buntu
Yoga Y,5,5/31/2024 1:26,pengalaman selama saya menggunakan gmaps ini masih belum ada keluhan apa apa meskipun terkadang saya masih belum mengerti saat diberi arahan oleh gmaps tapi secara keseluruhan untuk gmaps aplikasi yang bagus untuk menunjukan arah lokasi yang kita mau terimakasih
Muhammad Ersofyana,1,5/30/2024 12:13,assalamualaikum aplikasi setan bodoh jarak tempuhnya dekat di bikin jauh macet macet sedikit itu wajar masa jarak tinggal beberapa puluh meter dibuat putar putar dan tambah menjauh dari titik tujuan mohon kenerjanya diperbaharui wassalam
Rocky Bor,2,5/30/2024 10:21,saya ojol saya pengguna google maps untuk pekerjaan saya saya berterimakasih sekali karena google maps sangat membantu dalam pekerjaan saya namun beberapa waktu ini navigasinya sangat kacau saya di arahkan ke gang gang sempit yg padahal masih ada jalan lain yang tdk perlu masuk gang tolong di perbaiki seperti sebelumnya kami ojol jadi harus berpikir dulu apakah jalan ini bisa di lalui atau tidak
Khoiriyah Hoiriyah,1,5/29/2024 19:20,di maps nya di hp ku lokasinya sering gak nyambung lokasinya padahal sinyal sudah bagus tapi tetap saja sering error
Irfan Ahmad,1,5/29/2024 17:14,ketika saya membuka aplikasi selalu black screen sehingga saya harus ke playstore dahulu hanya untuk membuka maps tolong perbaiki bug ini
Rafika Firdani Auliya,1,5/29/2024 16:14,untuk linimasa jadi tidak bisa memilih perangkat mana yang mau di aktifkan linimasanya terus kalau  email di pakai di  hp jadinya linimasa di  hp itu terbaca semua jadi ribet banget perjalanannya krn  hp ya beda orang semua dan hasil linimasa tidak bisa di cek di komputer jadi semakin buruk kualitas linimasanya
Abang edo,1,5/29/2024 12:20,jelas yg dipilih kendaraan malah dikasih jalan sawah belumpur kubangan org lihat maps itu artinya tidak tau jalan klo salah ambil rute jangan seenaknya ikut ganti rute apalagi pilihannya kendaraan yaa tetap arahkan kejalan utama terus pilihan lebih lambat gunanya untuk apaa bedakan dong mana jalan yang bisa dilalui dengan jalan enggak layak apalagi jalan sawah bedakan maps buat navigasi dengan maps pejalan kaki jangan dijadikan satu tempat ujung nya mana rute terdekat main arahin aja
kotan kolores,3,5/29/2024 11:45,kenapa gps saya selalu rendah ya padahal sudah ganti kartu jaringan yg lebih kuat dan sudah kalibrasi berulang ulang tetap saja rendah
Spear of Longinus,1,5/28/2024 19:49,setelah update microphone jadi tidak bisa digunakan jadinya harus ngetik merepotkan ketika di downgrade microphone jadi berfungsi kembali
Ahmad Cahyadi,1,5/28/2024 18:16,sinyal hilang terus kerja apa kau sebenarnya tak becus perbaiki masalah seperti ini kalian di gaji bukan untuk malas melainkan kalian berikan pelayanan navigasi yg akurat gaji besar tetapi hasilnya buruk hp sudah ram  sinyal simpati jaringan kau inilah yg bermasalah kau tanam kabel optik panjang tp untuk pengguna motor gk sama sekali akurat jaringan hilang terus kalau sudah bagus sy akan ubah rating sy karena sy saat ini kecewa dengan navigasi yg saat ini kau perbarui tp jelek
Inrianiglorya sabneno,5,5/28/2024 16:09,sangat membantu aku untuk mengetahui jalan yang belum pernah di kunjungi sebelumnya gambar yang ada juga sangat jelas sehingga sangat mudah dalam membaca arah
M KaMiL,5,5/28/2024 10:45,google maps adalah aplikasi navigasi yang luar biasa fitur pencarian lokasi yang akurat dan peta yang terperinci membuat perjalanan saya menjadi lebih mudah
Taufik Yulianto,5,5/28/2024 7:18,google maps mantap sangat membantu saat menuju alamat yang baru pertama kali dituju terimakasih maps semoga makin akurat dalam menemukan titik tujuan dari para penggunanya yang suka nyasar itu membuktikan mereka belum familiar menggunakan google maps tidak fokus terhadap arahan yang diberikan makanya suka dicarikan jalan lain yang lebih memutar sebelum digunakan setting dulu peruntukannya r r lalu kuota internet jangan terlalu irit karena ketika kuota tipis akses internet nya lambat
siti lindayani,5,5/27/2024 19:10,tempat yg recommended untuk di kunjungi view nya indah makanan nya pun tak kalah enak nya bisa di pakai buat prewedding bawa keluarga bahkan orang tercinta
Rian Febriana,1,5/27/2024 14:27,kenapa setelah saya update malah jadi sering error ya gps saya padahal sebelumnya sebelum diupdate gk ada kendala aman aja tapi setelah diupdate malah sering hilang gps saya dan sering eror
Syam earlangga,3,5/27/2024 0:08,maps makin parah makin kesini bukan nya semakin bagus malah sering abu enggak bergerak kadang kasih arah belok nya juga suka telat
Tina Tari,5,5/26/2024 18:20,sebelumnya bagus berfungsi dengan baik tapi setelah di update aplikasinya malah mapsnya jadi kacau update linimasanya kacau tidak berjalan sama sekali
Putra Samhedi,1,5/26/2024 16:19,aplikasi ini sangat membantu tapi sayangnya sekarang susah untuk menambahkan lokasi terkadang tiba tiba lokasi telah dihapus mohon pencerahan
25. Umi Khulsum,5,5/26/2024 13:00,google maps adalah aplikasi navigasi yang luar biasa fitur pencarian lokasi yang akurat dan peta yang terperinci membuat perjalanan saya menjadi lebih mudah dan efisien saya juga sangat menghargai fitur lalu lintas real time yang membantu saya menghindari kemacetan
fery sujarwadi,4,5/26/2024 11:38,maaf untuk sebelum nya untuk kendaraan coba bisa di perbaharui untuk mobil besar dan kecil soalnya ada larangan untuk kendaraan besar di jaan tol atau jalan umum terimakasih
Rona Uly Helen Cristina,5,5/26/2024 9:25,google maps mengalami kemajuan saya sangat terbantu dengan adanya fitur yang dapat melihat kapan bus akan tiba terimakasih
arifudin sahli,2,5/26/2024 7:37,rekomendasi jalannya payah sering menunjukkan jalan yang sempit dan membuat tidak nyaman berkendara sebaiknya di berikan opsi untuk menghilangkan menghindari jalan sempit
Jagung rebus,5,5/26/2024 2:48,google maps adalah aplikasi navigasi yang luar biasa fitur pencarian lokasi yang akurat dan peta yang terperinci membuat perjalanan saya lebih mudah dan efisien saya juga sangat menghargai fitur lalu lintas real time yang membantu saya menghindari kemacetan terimakasih goggle maps anda benar benar mengubah hidup saya menjadi lebih mudah
Tom Kusuma,1,5/24/2024 23:40,dear gmaps dan google tolong perbaiki mengenai jalur mobil sering terlalu kecil jalan yg dipilihkan g maps untuk dilalui mohon beri jalan yang sesuai untuk mobil
Arif Rachman Dwianto,1,5/24/2024 17:31,di update makin berat saja jadi susah saat di pakai lama muncul panah serta melambat parah sehingga saat di pakai sangat mengganggu sekali
Si Cadel Kasep,1,5/24/2024 15:28,maaf bintang  ya soalnya maps nya suka ngelag pas di pake jujur suka gak jalan malahan saya udah dimana tapi di maps nya kok enggak jalan jalan mohon di perbaiki lagi ya soalnya ini selalu di pakai oleh saya kalau mau berpergian makasih selalu di upgrade tapi kok gitu terus google maps nya jelek
Nurlia Herawati,3,5/24/2024 9:10, mohon dibantu untuk penambahan fasilitas dalam aplikasi ini yakni maps tol di indonesia disesuaikan dengan update terbaru awal  karena pasti masyarakat indonesia akan sangat tertarik jika telah tersedia update maps terkait tol indonesia  terkait update data maps tolong diperbarui terutama yang data mapsnya sudah  tahun lebih agar akurasi data maps ini sangat update dan makin baik kedepannya
Fitra Kurniawan,1,5/23/2024 23:10,akhir akhir ini mapsnya tidak bergerak sama sekali untuk driver online tidak sangat membantu untuk mencari alamat seseorang
roedytea chanel,5,5/23/2024 21:05,panahnya kenapa diam terus ya enggak gerak gerak padahal udah di update akurasi tinggi chace udah di hapus saya kasih bintang  dlu klo dah normal baru saya kasih bintang 
Anastasia Enjellina,1,5/23/2024 20:12,mengapa google maps saya sekarang ini tidak bisa di pakai sehingga saya menjadi kesusahan untuk mencari tempat tujuan semoga google maps saya cepat di perbaiki
SITI RAHMADANI,5,5/23/2024 15:08,google maps adalah aplikasi navigasi yang luar biasa fitur pencarian lokasi yang akurat dan peta yang terperinci membuat perjalanan saya menjadi lebih mudah dan efisien saya juga sangat menghargai fitur lalu lintas real time yang membantu saya menghindari kemacetan terima kasih google maps anda benar benar membuat hidup saya lebih mudah
Imas Masliah,5,5/21/2024 20:36,sangat membantu bagi yang buta arah atau yang selalu membutuhkan petunjuk jalan dan tidak perlu khawatir ini sudah sampai mana ya karena dengan google maps semua terselesaikan mudah digunakan tidak ribet ditambah ada fitur suara yang mengarahkan google maps top
Pratido Rindy,4,5/20/2024 17:19,halo developer kenapa sekarang maps kalau zoom out sedikit saja view jalan utama jadi hilang coba jalan kabupaten provinsi malahan jalan desanya masih nampak jadi bikin takut kita mau zoom out buat lihat rute malahan hilang di zoom in kelihatan lagi
Susanto,5,5/20/2024 13:54,bikin sengsara maps nya tolong perbarui lagi seperti bulan bulan yang kemarin maps macam apa ini buat sengsara di jalan setiap mau jalan maps nya tidak mengikuti jalannya saya yg ada berhenti dlu setelah satu menit baru jalan lgi mapnya atau saya hapus aplikasi maps ini enggak beguna
Haji Herman,3,5/17/2024 22:04,maps salah bikin pusing ngarahin kejalan sempit padahal jalan besar ada mohon di perbaiki agar yg menggunakan maps tidak tersesat di jalan
Ade Warman,3,5/16/2024 19:42,tolong dong updatenya di tingkatin lagi saya udah lama pakai aplikasi ini makin kesini makin suka salah di maps biru pas real nya malah macet begitupun sebaliknya
Budi Ujung,4,5/8/2024 0:21,sering tidak sesuai lokasi sistem sering berubah dan error sering telat memberi petunjuk akurasi kurang maksimal tolong diperbaiki saya sering telat update kalah cepet dgn aplikasi maps yg lain terimakasih
Putra Pangeran Darah Biru,1,5/1/2024 12:43,jarak dekat di tempuh dengan rute yang jauh dan memutar waktu terbuang sangat banyak tingkat akurasi titik di maps kadang lompat ke titik sebelahnya menguras daya baterai pemakaian data internet yang banyak
Nurul Hadi,1,4/28/2024 7:32,saya sebagai driver ojol pemula di kota yg harus bergantung ke google maps sangat tidak puas setelah aplikasi google maps di update keluhannya ketika saya mau ngambil penumpang rute yg di kasih google maps selalu tidak tepat sasaran jd menurut sy harus segera diperbaiki lagi sehingga mempermudah kan kita
faldin Setiardi,1,4/24/2024 12:27,tolong perbaiki sistem dan navigasi nya sesudah update kadang saat diam dan tidak berkendara suka melesat dan lebih dari  meter kadang lebih melesat nya dan saat berkendara justru titik biru malah diam enggak bergerak sama sekali navigasi nya padahal koneksi internet bagus dan kuota saya banyak tolong perbaiki bug dan sistem navigasi nya soalnya maps ini berguna banget buat saya yang sebagai driver ojek
Ary Ramdhani,1,4/24/2024 9:06,setelah di update bukannya tambah bagus kenapa ini sebaliknya saya mohon kepada pengembang google maps tolong perbaiki navigasinya tidak sesuai dengan real time perjalanan dan saat perjalanan tidak berubah menjadi tanda panah mohon perbaiki setelah benar baru saya rubah kembali menjadi bintang  terimakasih
Arya Juliartawan,2,4/21/2024 21:28,kenapa setelah di update maps sering bermasalah ke tidak akurat untuk membaca lokasi sering terjadi kesalahan contohnya di maps tertera harus belok kiri namun google maps mengatakan belok kanan dan lokasi sebenarnya berada di posisi kanan tapi di katakan posisi kiri sering error ini sangat menyusahkan karena saya sebagai driver ojek online sangat merasakan dampak atas ke tidak stabilan maps saat ini semoga ada perbaikan untuk permasalahan ini terimakasih
Irwan Fikri,2,4/21/2024 9:26,gambar objek bangunan di suatu tempat pada mode satelit tidak update masih menampilkan gambar beberapa tahun sebelumnya kalau memang itu benar berdasarkan data citra satelit tentunya menampilkan objek pada wilayah tertentu secara realtime lebih baik lagi jika di lengkapi dengan rute jalur transportasi perairan umum antar daerah perairan dan antar pulau terimakasih
